{
  "id": "motis-feed-proxy",
  "name": "MOTIS Feed Proxy",
  "version": "1.0.0",
  "description": "Transitous-style feed proxy for GTFS-RT and GBFS URLs that need header/URL indirection.",
  "license": "MIT",
  "quality": "built-in",
  "homepage": "https://github.com/public-transport/transitous",
  "subjectData": {
    "storesPersonalData": false,
    "strategy": "not_personal",
    "registrationIds": [],
    "operatorInstructions": null
  },
  "container": {
    "image": "nginx",
    "tag": "1.31.6-alpine",
    "digest": "sha256:df221db836e1754089190208cee7eeda94f233197056426eda74a43ab1abeac2",
    "containerName": "motis-feed-proxy",
    "expose": [80],
    "networkAliases": ["rt.openmapx.local"],
    "memory": "256m",
    "restart": "unless-stopped",
    "healthcheck": {
      "type": "http",
      "path": "/healthz",
      "port": 80,
      "interval": "30s",
      "timeout": "5s",
      "retries": 3
    }
  },
  "provides": ["proxy"],
  "consumes": [
    {
      "type": "motis-feed-proxy-config",
      "mountAt": "/etc/nginx/conf.d",
      "readOnly": true,
      "required": true
    }
  ],
  "ui": {
    "category": "transit"
  },
  "configSchema": {
    "type": "object",
    "properties": {
      "OPENMAPX_MEMORY_MIB": {
        "type": "integer",
        "title": "Container memory limit (MiB)",
        "minimum": 16,
        "maximum": 1048576,
        "description": "Optional Docker resource limit. Unset preserves the image manifest limit. Clear the field to restore the manifest limit."
      },
      "OPENMAPX_CPU_LIMIT": {
        "type": "number",
        "title": "Container CPU limit",
        "minimum": 0.125,
        "maximum": 256,
        "description": "Optional Docker resource limit. Unset preserves the image manifest limit. Clear the field to restore the manifest limit."
      }
    }
  }
}
