{
  "id": "app-web",
  "name": "OpenMapX Web",
  "version": "1.0.0",
  "description": "Next.js 16 frontend. MapLibre + MUI.",
  "license": "MIT",
  "quality": "built-in",
  "subjectData": {
    "storesPersonalData": false,
    "strategy": "not_personal",
    "registrationIds": [],
    "operatorInstructions": null
  },
  "container": {
    "image": "ghcr.io/openmapx/web",
    "tag": "main",
    "expose": [3000],
    "environment": {
      "BASEMAP_PROVIDER": "${BASEMAP_PROVIDER:-}",
      "NEXT_PUBLIC_API_URL": "https://${DOMAIN:-localhost}",
      "INTERNAL_API_URL": "http://app-api:3001",
      "NEXT_PUBLIC_MAP_STYLE_URL": "${NEXT_PUBLIC_MAP_STYLE_URL:-}",
      "NEXT_PUBLIC_TILES_URL": "${NEXT_PUBLIC_TILES_URL:-}",
      "NEXT_PUBLIC_STYLE_PROVIDER": "${NEXT_PUBLIC_STYLE_PROVIDER:-openmapx}",
      "NEXT_PUBLIC_TRAFFIC_MIN_ZOOM": "${NEXT_PUBLIC_TRAFFIC_MIN_ZOOM:-}",
      "NEXT_PUBLIC_TRAFFIC_TILE_URL_TEMPLATE": "${NEXT_PUBLIC_TRAFFIC_TILE_URL_TEMPLATE:-}",
      "NEXT_PUBLIC_CYCLOSM_TILE_URL_TEMPLATE": "${NEXT_PUBLIC_CYCLOSM_TILE_URL_TEMPLATE:-}",
      "NEXT_PUBLIC_TERRAIN_DEM_TILEJSON_URL": "${NEXT_PUBLIC_TERRAIN_DEM_TILEJSON_URL:-}",
      "NEXT_PUBLIC_TERRAIN_CONTOUR_TILEJSON_URL": "${NEXT_PUBLIC_TERRAIN_CONTOUR_TILEJSON_URL:-}",
      "NEXT_PUBLIC_TERRAIN_ATTRIBUTION_NAME": "${NEXT_PUBLIC_TERRAIN_ATTRIBUTION_NAME:-}",
      "NEXT_PUBLIC_TERRAIN_ATTRIBUTION_URL": "${NEXT_PUBLIC_TERRAIN_ATTRIBUTION_URL:-}",
      "LEGAL_NAME": "${LEGAL_NAME:-}",
      "LEGAL_STREET": "${LEGAL_STREET:-}",
      "LEGAL_POSTAL_CODE": "${LEGAL_POSTAL_CODE:-}",
      "LEGAL_CITY": "${LEGAL_CITY:-}",
      "LEGAL_COUNTRY": "${LEGAL_COUNTRY:-}",
      "LEGAL_EMAIL": "${LEGAL_EMAIL:-}",
      "LEGAL_PHONE": "${LEGAL_PHONE:-}",
      "LEGAL_JURISDICTION_CITY": "${LEGAL_JURISDICTION_CITY:-}"
    },
    "memory": "512m",
    "restart": "unless-stopped",
    "dependsOn": [{ "service": "app-api", "condition": "service_healthy" }]
  },
  "exposure": {
    "proxy": {
      "enabled": true,
      "pathPrefix": "/",
      "priority": 1,
      "additionalRoutes": [
        {
          "path": "/sw.js",
          "middleware": ["sw-no-cache@file"]
        },
        {
          "path": "/manifest.webmanifest",
          "middleware": ["manifest-short-cache@file"]
        }
      ]
    }
  },
  "ui": { "category": "application" }
}
