{
  "id": "__ID__",
  "name": "My Community Service",
  "version": "1.0.0",
  "quality": "community",
  "container": {
    "image": "ghcr.io/your-org/__ID__",
    "tag": "latest",
    "expose": [],
    "environment": {},
    "dependsOn": [],
    "healthcheck": {
      "type": "http",
      "path": "/health",
      "port": 8080,
      "interval": "30s",
      "timeout": "10s",
      "retries": 3,
      "startPeriod": "10s"
    }
  },
  "provides": [],
  "ownsSchema": "__ID__"
}
