{
  "id": "local-ai",
  "name": "Local AI (Ollama)",
  "version": "1.0.0",
  "description": "Self-hosted LLM inference (Ollama) for natural-language search parsing.",
  "license": "MIT",
  "quality": "built-in",
  "homepage": "https://ollama.com/",
  "subjectData": {
    "storesPersonalData": false,
    "strategy": "not_personal",
    "registrationIds": [],
    "operatorInstructions": null
  },
  "container": {
    "image": "ollama/ollama",
    "tag": "0.40.3",
    "digest": "sha256:adca95a12c2b386a8f9a995e7fa0600e187e3323b5e5522f5a6c3b1ec73eff99",
    "expose": [11434],
    "environment": {
      "OLLAMA_KEEP_ALIVE": "${OLLAMA_KEEP_ALIVE:-30m}",
      "OLLAMA_MAX_LOADED_MODELS": "${OLLAMA_MAX_LOADED_MODELS:-1}"
    },
    "memory": "${LOCAL_AI_MEMORY:-8g}",
    "restart": "unless-stopped",
    "healthcheck": {
      "type": "exec",
      "command": ["ollama", "list"],
      "interval": "30s",
      "timeout": "5s",
      "retries": 5,
      "startPeriod": "60s"
    }
  },
  "provides": ["llm-inference"],
  "volumes": [{ "name": "openmapx-ollama", "mountAt": "/root/.ollama", "backup": false }],
  "exposure": {
    "hostPorts": [{ "container": 11434, "host": 11434, "bindAddress": "127.0.0.1" }]
  },
  "ui": { "category": "infrastructure" }
}
