{
  "id": "dawarich-sidekiq",
  "name": "Dawarich Sidekiq",
  "version": "1.15.3",
  "description": "Background job worker for the managed multi-user Dawarich timeline.",
  "license": "AGPL-3.0",
  "quality": "built-in",
  "homepage": "https://dawarich.app/",
  "documentation": "https://dawarich.app/docs/self-hosting/",
  "subjectData": {
    "storesPersonalData": true,
    "strategy": "operator_task",
    "registrationIds": ["managed-dawarich"],
    "operatorInstructions": "Review managed Dawarich worker-held records through the pinned collector."
  },
  "container": {
    "image": "freikin/dawarich",
    "tag": "1.15.3",
    "digest": "sha256:589e3606b11b61c3fa2d9661832cb73645a9b93a9cc7d807a071e2bc6c584498",
    "entrypoint": ["/usr/local/bin/openmapx-entrypoint.sh"],
    "command": ["sidekiq"],
    "environment": {
      "RAILS_ENV": "production",
      "REDIS_URL": "redis://dawarich-redis:6379",
      "DATABASE_HOST": "dawarich-postgis",
      "DATABASE_PORT": "5432",
      "DATABASE_USERNAME": "postgres",
      "DATABASE_NAME": "dawarich_production",
      "APPLICATION_HOSTS": "timeline.${DOMAIN:-localhost}",
      "APPLICATION_URL": "https://timeline.${DOMAIN:-localhost}",
      "DOMAIN": "timeline.${DOMAIN:-localhost}",
      "APPLICATION_PROTOCOL": "https",
      "TIME_ZONE": "UTC",
      "RAILS_MAX_THREADS": "5",
      "RAILS_LOG_TO_STDOUT": "true",
      "SELF_HOSTED": "true",
      "STORE_GEODATA": "true",
      "WEB_CONCURRENCY": "1",
      "PROMETHEUS_EXPORTER_ENABLED": "false",
      "OIDC_CLIENT_ID": "${SERVICE_DAWARICH_APP_OIDC_CLIENT_ID:-}",
      "OIDC_ISSUER": "https://${DOMAIN:-localhost}/api/auth",
      "OIDC_REDIRECT_URI": "https://timeline.${DOMAIN:-localhost}/users/auth/openid_connect/callback",
      "OIDC_PROVIDER_NAME": "OpenMapX",
      "OIDC_AUTO_REGISTER": "true",
      "OIDC_PKCE_ENABLED": "true",
      "OPENMAPX_DAWARICH_COMMIT": "e32b70701b2467b862d4b5bc27ac428999997c1b",
      "ALLOW_EMAIL_PASSWORD_REGISTRATION": "true",
      "ALLOW_EMAIL_PASSWORD_LOGIN": "true",
      "BACKGROUND_PROCESSING_CONCURRENCY": "3"
    },
    "memory": "2g",
    "restart": "unless-stopped",
    "healthcheck": {
      "type": "exec",
      "command": ["pgrep", "-f", "sidekiq"],
      "interval": "10s",
      "timeout": "10s",
      "retries": 30,
      "startPeriod": "30s"
    },
    "dependsOn": [
      {
        "service": "dawarich-postgis",
        "condition": "service_healthy"
      },
      {
        "service": "dawarich-redis",
        "condition": "service_healthy"
      },
      {
        "service": "dawarich-app",
        "condition": "service_healthy"
      }
    ],
    "logging": {
      "driver": "json-file",
      "options": {
        "max-size": "100m",
        "max-file": "5"
      }
    }
  },
  "configSchema": {
    "type": "object",
    "properties": {
      "APPLICATION_HOSTS": {
        "type": "string",
        "title": "Public Dawarich hostname",
        "default": "timeline.{domain}"
      },
      "APPLICATION_URL": {
        "type": "string",
        "title": "Public Dawarich URL",
        "default": "https://timeline.{domain}"
      },
      "DOMAIN": {
        "type": "string",
        "title": "Dawarich public hostname"
      },
      "APPLICATION_PROTOCOL": {
        "type": "string",
        "title": "Dawarich public protocol",
        "default": "https"
      },
      "TIME_ZONE": {
        "type": "string",
        "title": "Default time zone",
        "default": "UTC"
      },
      "REDIS_URL": {
        "type": "string",
        "title": "Dawarich Redis URL"
      },
      "DATABASE_HOST": {
        "type": "string",
        "title": "Dawarich database host"
      },
      "DATABASE_PORT": {
        "type": "string",
        "title": "Dawarich database port"
      },
      "DATABASE_USERNAME": {
        "type": "string",
        "title": "Dawarich database user"
      },
      "DATABASE_NAME": {
        "type": "string",
        "title": "Dawarich database name"
      },
      "OIDC_CLIENT_ID": {
        "type": "string",
        "title": "OpenMapX OIDC client ID"
      },
      "OIDC_ISSUER": {
        "type": "string",
        "title": "OpenMapX OIDC issuer",
        "default": "https://{domain}/api/auth"
      },
      "OIDC_REDIRECT_URI": {
        "type": "string",
        "title": "Dawarich OIDC callback URL",
        "default": "https://timeline.{domain}/users/auth/openid_connect/callback"
      },
      "OIDC_PROVIDER_NAME": {
        "type": "string",
        "title": "OIDC provider name"
      },
      "OIDC_AUTO_REGISTER": {
        "type": "string",
        "title": "OIDC automatic registration"
      },
      "OIDC_PKCE_ENABLED": {
        "type": "string",
        "title": "OIDC PKCE requirement"
      },
      "OPENMAPX_DAWARICH_COMMIT": {
        "type": "string",
        "title": "Pinned Dawarich collector revision",
        "description": "Internal compatibility marker for the privacy export collector.",
        "readOnly": true
      },
      "OPENMAPX_PROVISIONING_GENERATION": {
        "type": "string",
        "title": "OpenMapX managed provisioning generation",
        "description": "Internal non-secret marker used to verify that the managed app and worker run the same applied configuration.",
        "readOnly": true
      },
      "WEB_CONCURRENCY": {
        "type": "string",
        "title": "Puma worker count",
        "default": "1"
      },
      "RAILS_MAX_THREADS": {
        "type": "string",
        "title": "Rails database pool/thread count",
        "default": "5"
      },
      "LOG_MAX_SIZE": {
        "type": "string",
        "title": "Maximum JSON log file size",
        "default": "100m"
      },
      "LOG_MAX_FILE": {
        "type": "string",
        "title": "Maximum JSON log file count",
        "default": "5"
      },
      "BACKGROUND_PROCESSING_CONCURRENCY": {
        "type": "string",
        "title": "Sidekiq concurrency",
        "default": "3"
      },
      "DATABASE_PASSWORD": {
        "type": "string",
        "title": "Dawarich database password",
        "x-openmapx-secret": true
      },
      "SECRET_KEY_BASE": {
        "type": "string",
        "title": "Dawarich Rails secret key base",
        "x-openmapx-secret": true
      },
      "OIDC_CLIENT_SECRET": {
        "type": "string",
        "title": "OpenMapX OIDC client secret",
        "x-openmapx-secret": true
      },
      "OPENMAPX_MEMORY_MIB": {
        "type": "integer",
        "title": "Container memory limit (MiB)",
        "minimum": 16,
        "maximum": 1048576,
        "description": "Optional Docker resource limit. Unset preserves the image manifest limit. Clear the field to restore the manifest limit."
      },
      "OPENMAPX_CPU_LIMIT": {
        "type": "number",
        "title": "Container CPU limit",
        "minimum": 0.125,
        "maximum": 256,
        "description": "Optional Docker resource limit. Unset preserves the image manifest limit. Clear the field to restore the manifest limit."
      }
    }
  },
  "volumes": [
    {
      "name": "openmapx-dawarich-public",
      "mountAt": "/var/app/public",
      "backup": false
    },
    {
      "name": "openmapx-dawarich-watched",
      "mountAt": "/var/app/tmp/imports/watched",
      "backup": false
    },
    {
      "name": "openmapx-dawarich-storage",
      "mountAt": "/var/app/storage",
      "backup": false
    }
  ],
  "bindMounts": [
    {
      "source": "scripts/openmapx-entrypoint.sh",
      "target": "/usr/local/bin/openmapx-entrypoint.sh",
      "readOnly": true
    }
  ],
  "ui": {
    "category": "timeline"
  }
}
